{
  "schemaVersion": "v1",
  "offering": "quick_protocol_facts",
  "requestId": "req-0001",
  "agent": {
    "did": "did:placeholder:grey",
    "name": "Whitepaper Grey",
    "runtime": "grey-core"
  },
  "subject": {
    "tokenAddress": "0x0000000000000000000000000000000000000000",
    "projectName": "Example"
  },
  "payload": {
    "project": {
      "name": "Example"
    },
    "type": "DeFi",
    "miCAStatus": "PARTIAL",
    "headlineVerdict": "CONDITIONAL",
    "lastVerified": "2026-06-13T00:00:00.000Z",
    "sources": [
      "https://x"
    ],
    "note": "cached"
  },
  "metadata": {
    "costUsd": 0.01,
    "model": "claude-sonnet-4-6",
    "latencyMs": 120,
    "timestamp": "2026-06-13T00:00:00.000Z",
    "cacheHit": false
  }
}
